{
  "task_queue_id": "aaaaaaaa-aaaa-4aaa-8aaa-aaaaaaaaaaaa",
  "schema_version": "1.0.0",
  "problem_brief_ref": "artifact://problem_brief/8b7e4f2e",
  "queue_status": "OPEN",
  "items": [
    {
      "task_packet_ref": "artifact://task_packet/3fa85f64",
      "depends_on": [],
      "approval": { "required": false, "status": "WAIVED" }
    }
  ],
  "created_at": "2026-04-07T12:00:00Z",
  "updated_at": "2026-04-07T12:00:00Z"
}
